title,score,subreddit,url,created_utc,author,num_comments,retrieved_at
Probably the best chips I’ve had in my life.,1919,chips,https://i.redd.it/h2809nhfob5e1.jpeg,2024-12-07 00:38:44,Successful-Pie-7686,226,2025-04-03 19:59:27.065978
"So one of my wife's best friends eats ONLY cheese and potatoes, and has for years. How the hell is that woman functioning ok?",10834,NoStupidQuestions,https://www.reddit.com/r/NoStupidQuestions/comments/16lwx5g/so_one_of_my_wifes_best_friends_eats_only_cheese/,2023-09-18 14:22:01,omnimater,1441,2025-04-03 19:59:27.065978
Do you guys REALLY eat those All Dressed Lays Potato Chips? Or is the whole “Canada’s favorite” thing just a marketing gimmick?,711,AskACanadian,https://www.reddit.com/r/AskACanadian/comments/1izqmut/do_you_guys_really_eat_those_all_dressed_lays/,2025-02-27 21:12:17,Friendly_Sea_4848,865,2025-04-03 19:59:27.065978
"TIL about ""The Whole Shabangs"" potato chips, available almost exclusively from US Prison system commissaries. Ex-cons consider these chips to be the best chip out there, and a high-point of their incarceration. Many end up dismayed and disappointed at their lack of availability ""on the outside"".",51010,todayilearned,https://mentalfloss.com/article/86244/popular-potato-chip-brand-you-can-only-find-prison,2019-05-20 19:09:10,VivaNOLA,3082,2025-04-03 19:59:27.065978
potted meat and chips that are lying about being potato skins,2445,shittyfoodporn,https://i.redd.it/2wmskijymvib1.jpg,2023-08-18 14:13:39,LugubriousButtNoises,469,2025-04-03 19:59:27.065978
"I hosted my non-vegan in laws for 2 weeks, here’s what we ate",6059,veganrecipes,https://www.reddit.com/gallery/1j3gh9r,2025-03-04 17:38:41,ElineBonnin,880,2025-04-03 19:59:27.065978
The blue cheese Irish potato chips are delicious!,595,traderjoes,https://i.redd.it/j72lfj1d9s2e1.jpeg,2024-11-24 05:12:08,Sure_Ranger_4487,88,2025-04-03 19:59:27.065978
Best chips in Pennsylvania change my mind!!!!!!!!!,563,Pennsylvania,https://i.redd.it/qjgf37piyzhc1.jpeg,2024-02-11 18:09:58,Aggressive-Carls878,219,2025-04-03 19:59:27.065978
What is the best flavor of potato chips ?,13,AskReddit,https://www.reddit.com/r/AskReddit/comments/1j43q4m/what_is_the_best_flavor_of_potato_chips/,2025-03-05 14:01:20,Virtual_Bug5486,173,2025-04-03 19:59:27.065978
These are both the best and worst potato chips I have ever had. What do you think of Sterzings?,194,Iowa,https://i.redd.it/l8cjfynpl7le1.jpeg,2025-02-25 04:02:30,Santer-Klantz,91,2025-04-03 19:59:27.065978
